query;score;competitiveness
шрифт брайля переводчик;453;AVERAGE
переводчик на шрифт брайля;64;AVERAGE
переводчик шрифта брайля;35;AVERAGE
шрифт брайля переводчик на русский;25;AVERAGE
переводчик шрифт брайля;20;AVERAGE
переводчик с шрифта брайля;16;AVERAGE
переводчик со шрифта брайля;9;AVERAGE
переводчик в шрифт брайля;8;AVERAGE
шрифт брайля онлайн переводчик;8;AVERAGE
переводчик на шрифт брайля онлайн;7;AVERAGE
переводчик с шрифта брайля на русский;6;AVERAGE
брайль шрифт переводчик;4;AVERAGE
переводчик с русского на шрифт брайля;3;AVERAGE
шрифт брайля переводчик онлайн;2;AVERAGE
брайля шрифт переводчик;2;AVERAGE
переводчик шрифта брайля онлайн;2;AVERAGE
шрифт брайля русский алфавит переводчик;2;AVERAGE
онлайн переводчик шрифта брайля;2;AVERAGE
переводчик брайля;53;AVERAGE
язык брайля переводчик;38;AVERAGE
переводчик для слепых;23;AVERAGE
переводчик на язык брайля;14;AVERAGE
перевод на шрифт брайля онлайн;12;AVERAGE
переводчик на язык слепых;10;AVERAGE
перевод текста в шрифт брайля;8;AVERAGE
переводчик на брайль;8;AVERAGE
перевод с шрифта брайля на русский;7;AVERAGE
перевод брайля онлайн;7;AVERAGE
перевести текст в шрифт брайля онлайн;7;AVERAGE
перевод со шрифта брайля;6;AVERAGE
перевести на шрифт брайля;6;AVERAGE
конвертер шрифт брайля;5;AVERAGE
текст брайля переводчик;5;HIGH
перевод с языка брайля;5;AVERAGE
переводчик с языка слепых;5;AVERAGE
переводчик для слепых точками;5;AVERAGE
код брайля переводчик;5;AVERAGE
язык для слепых переводчик;4;AVERAGE
с брайля на русский;4;AVERAGE
онлайн переводчик брайля;4;AVERAGE
буквы для слепых точками перевод;4;AVERAGE
текст для слепых переводчик;4;AVERAGE
перевод в шрифт брайля онлайн;4;AVERAGE
расшифровка брайля онлайн;4;AVERAGE
перевод с азбуки брайля;3;AVERAGE
конвертер текста в шрифт брайля;3;AVERAGE
брайль переводчик онлайн;3;AVERAGE
перевести в шрифт брайля;3;AVERAGE
язык для слепых точки перевод;3;AVERAGE
перевод с шифра брайля;3;AVERAGE
шрифт брайля написать;3;AVERAGE
переводчик на брайля;3;AVERAGE
перевод для слепых;3;AVERAGE
перевести с брайля на русский;3;AVERAGE
язык брайля онлайн;3;AVERAGE